{
  "$schema": "https://json-schema.org/draft/2020-12/schema",
  "$id": "lint.schema.json",
  "title": "mtf-facts lint output",
  "description": "The JSON document that lint --json writes. index, interface_diff, schema_coverage, scope and callers are optional; schema_coverage is written only when a schema handoff binds to the run, and callers only when the run has a change, --base or --diff. With --ai the report has manifest_summary, its manifest holds only the finding, candidate and not_evaluated entries, each envelope tree has file_count in place of files, and index, interface_diff and schema_coverage are left out.",
  "type": "object",
  "additionalProperties": false,
  "required": ["envelope", "manifest", "findings", "candidates"],
  "allOf": [
    {
      "if": {"required": ["manifest_summary"], "properties": {"manifest_summary": true}},
      "then": {
        "properties": {
          "envelope": {"type": "object", "properties": {"inputs": {"type": "object", "properties": {
            "head": {"$ref": "envelope.schema.json#/$defs/ai_tree"},
            "base": {"oneOf": [{"type": "null"}, {"$ref": "envelope.schema.json#/$defs/ai_tree"}]}
          }}}},
          "manifest": {"type": "array", "items": {"type": "object", "properties": {"status": {"enum": ["finding", "candidate", "not_evaluated"]}}}},
          "index": false,
          "interface_diff": false,
          "schema_coverage": false
        }
      }
    },
    {
      "if": {"not": {"required": ["manifest_summary"], "properties": {"manifest_summary": true}}},
      "then": {
        "properties": {
          "envelope": {"type": "object", "properties": {"inputs": {"type": "object", "properties": {
            "head": {"$ref": "envelope.schema.json#/$defs/tree"},
            "base": {"oneOf": [{"type": "null"}, {"$ref": "envelope.schema.json#/$defs/tree"}]}
          }}}}
        }
      }
    }
  ],
  "properties": {
    "envelope": {"$ref": "envelope.schema.json"},
    "manifest": {"$ref": "manifest.schema.json"},
    "manifest_summary": {
      "description": "Written with --ai only. Counts every manifest entry by status, counts the clean and not_applicable entries the ai manifest leaves out by rule family (the rule id up to its first dot), and lists every area with a manifest entry, sorted. A rule with no entry in a listed area was clean or not_applicable there, or has no entry in that area in the full report either.",
      "type": "object",
      "additionalProperties": false,
      "required": ["status", "omitted_by_family", "areas"],
      "properties": {
        "status": {
          "type": "object",
          "additionalProperties": false,
          "required": ["finding", "candidate", "not_evaluated", "clean", "not_applicable"],
          "properties": {
            "finding": {"$ref": "#/$defs/count"},
            "candidate": {"$ref": "#/$defs/count"},
            "not_evaluated": {"$ref": "#/$defs/count"},
            "clean": {"$ref": "#/$defs/count"},
            "not_applicable": {"$ref": "#/$defs/count"}
          }
        },
        "omitted_by_family": {
          "type": "object",
          "propertyNames": {"pattern": "^[a-z]+$"},
          "additionalProperties": {
            "type": "object",
            "additionalProperties": false,
            "required": ["clean", "not_applicable"],
            "properties": {
              "clean": {"$ref": "#/$defs/count"},
              "not_applicable": {"$ref": "#/$defs/count"}
            }
          }
        },
        "areas": {"$ref": "#/$defs/areas"}
      }
    },
    "findings": {"type": "array", "items": {"$ref": "#/$defs/finding"}},
    "candidates": {"type": "array", "items": {"$ref": "#/$defs/candidate"}},
    "index": {"type": "array", "items": {"$ref": "#/$defs/index_entry"}},
    "interface_diff": {"$ref": "https://github.com/modulestf/facts/schema/interface-diff.schema.json"},
    "schema_coverage": {"$ref": "https://github.com/modulestf/facts/schema/facts-bundle.schema.json#/properties/schema_coverage"},
    "scope": {
      "description": "Which areas the run checked. areas_checked have their own manifest entries: those the change touches, or every area with --full-tree or without a change. areas_calling are the other areas that call a module listed in callers. areas_left_out are the rest. The three are disjoint and sorted.",
      "type": "object",
      "additionalProperties": false,
      "required": ["change", "full_tree", "areas_checked", "areas_calling", "areas_left_out"],
      "properties": {
        "change": {"enum": ["none", "base", "diff"]},
        "full_tree": {"type": "boolean"},
        "areas_checked": {"$ref": "#/$defs/areas"},
        "areas_calling": {"$ref": "#/$defs/areas"},
        "areas_left_out": {"$ref": "#/$defs/areas"}
      }
    },
    "callers": {
      "description": "Each root or submodule area the change touches whose versions.tf or terraform block, or variables.tf or a variable block, changed, with every area that calls it by a local path.",
      "type": "array",
      "items": {
        "type": "object",
        "additionalProperties": false,
        "required": ["module", "changed", "base_floors", "head_floors", "callers"],
        "properties": {
          "module": {"type": "string", "minLength": 1},
          "changed": {"type": "array", "items": {"enum": ["inputs", "versions"]}, "minItems": 1},
          "base_floors": {"description": "Null when the module is new.", "oneOf": [{"type": "null"}, {"$ref": "#/$defs/floors"}]},
          "head_floors": {"$ref": "#/$defs/floors"},
          "callers": {
            "type": "array",
            "items": {
              "type": "object",
              "additionalProperties": false,
              "required": ["area", "file", "line", "checked", "floors", "candidates"],
              "properties": {
                "area": {"type": "string", "minLength": 1},
                "file": {"type": "string", "minLength": 1},
                "line": {"description": "The line of the call's source argument.", "type": "integer", "minimum": 1},
                "checked": {"description": "The caller's area is in areas_checked.", "type": "boolean"},
                "floors": {"$ref": "#/$defs/floors"},
                "candidates": {"description": "The candidate_id of each structure.version-floor-understated candidate filed in the caller's area.", "type": "array", "items": {"type": "string", "pattern": "^C-[0-9]{3,}$"}}
              }
            }
          }
        }
      }
    }
  },
  "$defs": {
    "areas": {"type": "array", "items": {"type": "string", "minLength": 1}},
    "count": {"type": "integer", "minimum": 0},
    "floors": {
      "description": "The version floors a module declares, sorted by address.",
      "type": "array",
      "items": {
        "type": "object",
        "additionalProperties": false,
        "required": ["address", "source", "constraint"],
        "properties": {
          "address": {"type": "string", "pattern": "^(required_version|required_providers\\..+)$"},
          "source": {"description": "The normalized provider source address; null for required_version, or for a source that is not a plain string.", "type": ["string", "null"]},
          "constraint": {"description": "The constraints as written, joined with ', ', a plain string unquoted; null for a provider entry with no version.", "type": ["string", "null"]}
        }
      }
    },
    "candidate": {
      "description": "A detected defect for a model or an author to confirm. Never a finding on its own.",
      "type": "object",
      "additionalProperties": false,
      "required": ["candidate_id", "rule_id", "file", "line", "subject", "evidence", "evidence_complete"],
      "properties": {
        "candidate_id": {"type": "string", "pattern": "^C-[0-9]{3,}$"},
        "rule_id": {"type": "string", "pattern": "^[a-z]+\\.[a-z0-9]+(-[a-z0-9]+)*$"},
        "file": {"type": "string", "minLength": 1},
        "line": {"type": ["integer", "null"], "minimum": 1},
        "subject": {"description": "Scoped to the area: '<area>:<address>', such as '.:var.name'. A path rule's subject is its file or directory path.", "type": "string", "minLength": 1},
        "evidence": {"$ref": "https://github.com/modulestf/facts/schema/facts-bundle.schema.json#/$defs/candidate/properties/evidence"},
        "evidence_complete": {"type": "boolean"},
        "predates_change": {"description": "Present, and true, when the same rule fires on the base with the same subject: the defect is older than the change. Only for a rule whose check reads the base block, today structure.argument-order.", "const": true}
      }
    },
    "index_entry": {
      "description": "The lines of one block or argument and its area-scoped subject. Entries nest; the innermost range that holds a line names that line's subject. Entries with the same lines, such as a one-line block and the argument in it, are in nesting order, outer first: the later entry names those lines.",
      "type": "object",
      "additionalProperties": false,
      "required": ["file", "start_line", "end_line", "subject"],
      "properties": {
        "file": {"type": "string", "minLength": 1},
        "start_line": {"type": "integer", "minimum": 1},
        "end_line": {"type": "integer", "minimum": 1},
        "subject": {"description": "'<area>:<address>', such as '.:var.name'.", "type": "string", "minLength": 1}
      }
    },
    "finding": {
      "description": "The seven required fields of the reviewer findings schema.",
      "type": "object",
      "additionalProperties": false,
      "required": ["id", "rule_id", "severity", "file", "line", "summary", "suggested_fix"],
      "properties": {
        "id": {"type": "string", "pattern": "^F-[0-9]{3,}$"},
        "rule_id": {"type": "string", "pattern": "^[a-z]+\\.[a-z0-9]+(-[a-z0-9]+)*$"},
        "severity": {"enum": ["CRITICAL", "HIGH", "MEDIUM", "LOW"]},
        "file": {"type": "string", "minLength": 1},
        "line": {"type": ["integer", "null"], "minimum": 1},
        "summary": {"type": "string", "minLength": 1},
        "suggested_fix": {"type": "string", "minLength": 1}
      }
    }
  }
}
