{
  "envelope": {
    "schema_version": 1,
    "tool": {
      "name": "mtf-facts",
      "version": "v0.1.0",
      "binary_sha256": "2967a0e2142bbf18507684ef74f689ebb5c9be3bdbed0aaa9708e761312a863a"
    },
    "head_sha": "1111111111111111111111111111111111111111",
    "merge_base_sha": "2222222222222222222222222222222222222222",
    "registry_sha256": null,
    "inputs": {
      "head": {
        "tree_sha256": "19857b185eb00dc35517dc2af61a97333c2ae8aabe62e30d7c690ac0559a8819",
        "files": [
          {
            "path": "modules/child/variables.tf",
            "kind": "file",
            "sha256": "74e104e88a981b630f6b70cf8fb1e1e66335e7ae8a319521a548b6e623c10988"
          },
          {
            "path": "variables.tf",
            "kind": "file",
            "sha256": "83fb07723195af70805de34b0189bf7459fc9c95f7946cce78a946debd946511"
          }
        ]
      },
      "base": {
        "tree_sha256": "cb6d103da7b305e8c431d7528fd9d112b9c69ab7e2ca1ee2123e284597cd80a8",
        "files": [
          {
            "path": "modules/child/variables.tf",
            "kind": "file",
            "sha256": "74e104e88a981b630f6b70cf8fb1e1e66335e7ae8a319521a548b6e623c10988"
          },
          {
            "path": "variables.tf",
            "kind": "file",
            "sha256": "c9f58508820c4f5675a0a535d1fb2ea10a8db0c8c58eff81a822e65c6a6b44e9"
          }
        ]
      }
    },
    "schema_inputs": {
      "handoff_sha256": "3a3a3a3a3a3a3a3a3a3a3a3a3a3a3a3a3a3a3a3a3a3a3a3a3a3a3a3a3a3a3a3a",
      "head_sha": "1111111111111111111111111111111111111111",
      "merge_base_sha": "2222222222222222222222222222222222222222",
      "tree_hashes": {
        "head": "4b4b4b4b4b4b4b4b4b4b4b4b4b4b4b4b4b4b4b4b4b4b4b4b4b4b4b4b4b4b4b4b",
        "merge_base": "5c5c5c5c5c5c5c5c5c5c5c5c5c5c5c5c5c5c5c5c5c5c5c5c5c5c5c5c5c5c5c5c"
      },
      "schema_files": [
        {
          "path": "registry.terraform.io/hashicorp/aws/6.20.0.json",
          "sha256": "6d6d6d6d6d6d6d6d6d6d6d6d6d6d6d6d6d6d6d6d6d6d6d6d6d6d6d6d6d6d6d6d"
        }
      ]
    },
    "profile_sha256": "7e7e7e7e7e7e7e7e7e7e7e7e7e7e7e7e7e7e7e7e7e7e7e7e7e7e7e7e7e7e7e7e"
  },
  "manifest": [
    {
      "rule_id": "examples.versions-missing",
      "area": ".",
      "status": "not_applicable"
    },
    {
      "rule_id": "structure.missing-description",
      "area": ".",
      "status": "clean"
    },
    {
      "rule_id": "structure.variable-untyped",
      "area": ".",
      "status": "candidate"
    }
  ],
  "findings": [],
  "candidates": [
    {
      "candidate_id": "C-001",
      "rule_id": "structure.variable-untyped",
      "file": "variables.tf",
      "line": 5,
      "subject": ".:var.added",
      "evidence": {
        "source_lines": [
          {
            "revision": "head",
            "file": "variables.tf",
            "line": 4,
            "text": "# Accepts a string or a list."
          }
        ],
        "base": null,
        "head": "any",
        "schema_facts": []
      },
      "evidence_complete": true
    }
  ],
  "index": [
    {
      "file": "variables.tf",
      "start_line": 5,
      "end_line": 8,
      "subject": ".:var.added"
    },
    {
      "file": "variables.tf",
      "start_line": 6,
      "end_line": 6,
      "subject": ".:var.added.type"
    }
  ],
  "interface_diff": {
    "head_sha": "1111111111111111111111111111111111111111",
    "merge_base_sha": "2222222222222222222222222222222222222222",
    "areas": [
      {
        "path": ".",
        "kind": "root",
        "required_version": {
          "base": ">= 1.3",
          "head": ">= 1.5.7"
        },
        "variables": [
          {
            "name": "retention_days",
            "change": "removed",
            "base": {
              "type": "number",
              "default": "30",
              "nullable": true,
              "sensitive": false,
              "description": null,
              "validation": []
            },
            "head": null
          },
          {
            "name": "name",
            "change": "changed",
            "base": {
              "type": "string",
              "default": "\"\"",
              "nullable": true,
              "sensitive": false,
              "description": null,
              "validation": []
            },
            "head": {
              "type": "string",
              "default": null,
              "nullable": false,
              "sensitive": false,
              "description": "\"Name of the thing.\"",
              "validation": [
                {
                  "condition": "length(var.name) <= 64",
                  "error_message": "\"name must be 64 characters or fewer, got ${length(var.name)}.\""
                }
              ]
            }
          }
        ],
        "outputs": [
          {
            "name": "arn",
            "change": "added",
            "base": null,
            "head": {
              "value": "try(aws_example_thing.this[0].arn, null)",
              "sensitive": false,
              "description": "\"ARN of the thing.\""
            }
          }
        ],
        "providers": [
          {
            "local_name": "aws",
            "change": "changed",
            "base": {
              "source": "hashicorp/aws",
              "version_constraint": ">= 5.95",
              "configuration_aliases": []
            },
            "head": {
              "source": "hashicorp/aws",
              "version_constraint": ">= 6.0",
              "configuration_aliases": []
            }
          }
        ],
        "resources": [
          {
            "address": "aws_example_thing.this",
            "change": "changed",
            "base": {
              "count": "var.create ? 1 : 0",
              "for_each": null,
              "provider": null
            },
            "head": {
              "count": null,
              "for_each": "var.things",
              "provider": null
            }
          }
        ],
        "moved": [
          {
            "from": "aws_example_thing.this",
            "change": "added",
            "base": null,
            "head": {
              "to": "aws_example_thing.this[\"default\"]"
            }
          }
        ],
        "module_calls": []
      },
      {
        "path": "examples/complete",
        "kind": "example",
        "required_version": null,
        "variables": [],
        "outputs": [],
        "providers": [],
        "resources": [],
        "moved": [],
        "module_calls": [
          {
            "name": "example",
            "change": "changed",
            "base": {
              "source": "../../",
              "version": null,
              "count": null,
              "for_each": null
            },
            "head": {
              "source": "../../",
              "version": null,
              "count": "0",
              "for_each": null
            }
          }
        ]
      }
    ]
  }
}
